iteration	n_walkers	direction	width	slice_fn	n_expand	n_shrink	n_slices	metric	delta	decision	note
0	64	de_mcz	scale_aware	fixed	3	12	1	0.000473	baseline	keep	baseline — ESS/eval on ill_cond_60+funnel_30+corr_60
1	64	de_mcz	scale_aware	fixed	3	6	1	0.000736	+0.000263	keep	fewer shrink evals
2	64	de_mcz	scale_aware	fixed	2	4	1	0.001075	+0.000602	keep	leaner expand+shrink
3	64	de_mcz	scale_aware	fixed	1	3	1	0.001443	+0.000970	keep	minimum practical budget
4	64	de_mcz	scale_aware	fixed	1	3	3	0.001006	-0.000437	discard	n_slices=3 not worth 3x evals
5	128	whitened	scale_aware	fixed	1	3	1	0.001190	-0.000253	discard	whitened worse than de_mcz at 64W/60D
6	128	de_mcz	scale_aware	fixed	1	3	1	0.001454	+0.000011	keep	n_walkers=128 marginal winner
7	256	de_mcz	scale_aware	fixed	1	3	1	0.001440	-0.000014	discard	256 walkers sublinear ESS
8	128	pca	scale_aware	fixed	1	3	1	0.001401	-0.000053	discard	pca hurts funnel
9	128	de_mcz	scale_aware	fixed	1	2	1	0.001673	+0.000219	keep	n_shrink=2 new best
10	128	de_mcz	scale_aware	fixed	1	1	1	0.001926	+0.000472	keep	n_shrink=1 new best
11	128	de_mcz	scale_aware	nurs	1	1	1	0.002226	+0.000772	keep	NURS density-proportional sampling
12	128	de_mcz	scale_aware	nurs	2	1	1	0.001336	-0.000890	discard	NURS n_expand=2 not worth 5 evals
13	64	de_mcz	scale_aware	nurs	1	1	1	0.002208	-0.000018	discard	64 walkers marginal worse
14	128	de_mcz	scale_aware	nurs	0	1	1	0.003339	+0.001113	keep	NURS n_expand=0 pure MH shift 2 evals
15	128	de_mcz	scale_aware	mh	1	1	1	0.005098	+0.001759	keep	NEW: mh slice 1 eval/step
16	256	de_mcz	scale_aware	mh	1	1	1	0.005106	+0.000008	keep	256 walkers marginal winner with mh
17	256	snooker	scale_aware	mh	1	1	1	0.005037	-0.000069	discard	snooker no Jacobian correction in MH
18	256	de_mcz	scale_aware	mh	1	1	1	0.005196	+0.000090	keep	scale_factor=2.0
19	256	de_mcz	scale_aware	mh	1	1	1	0.005345	+0.000149	keep	scale_factor=3.0 new best
20	256	de_mcz	scale_aware	mh	1	1	1	0.005315	-0.000030	discard	scale_factor=5.0 too wide
21	256	de_mcz	scale_aware	mh	1	1	1	0.005124	-0.000221	discard	Gaussian proposal worse than uniform
22	256	de_mcz	scale_aware	mh_multi	1	1	1	0.006314	+0.000969	keep	NEW: mh_multi k=1 massive jump
23	256	de_mcz	scale_aware	mh_multi	2	1	1	0.003157	-0.003157	discard	k=2 doubles evals, same ESS
24	256	momentum	scale_aware	mh_multi	1	1	1	0.000000	-0.006314	discard	momentum alpha=0.5: R-hat>1.1 (walkers streaming, not mixing)
25	256	momentum	scale_aware	mh_multi	1	1	1	0.000000	0.000000	discard	momentum alpha=0.7: R-hat>1.1
26	256	momentum	scale_aware	mh_multi	1	1	1	0.000000	0.000000	discard	momentum alpha=0.9: R-hat>1.1 extreme bias
27	256	momentum	scale_aware	mh_multi	1	1	1	0.000000	0.000000	discard	momentum alpha=0.95: R-hat>1.1
28	256	momentum	scale_aware	mh_multi	1	1	1	0.000000	0.000000	discard	momentum alpha=0.99: R-hat>1.1
29	256	momentum	scale_aware	mh_multi	1	1	1	0.000000	0.000000	discard	momentum alpha=0.999: R-hat>1.1 near-ballistic
30	256	de_mcz	scale_aware	nurs	1	1	1	0.000000	0.000000	discard	NURS 256W on new targets (mixture_10): R-hat fail
31	128	de_mcz	scale_aware	mh_multi	1	1	1	0.009200	baseline	keep	mh_multi 128W scale_factor=3.0 on new target set (baseline reset)
32	128	de_mcz	scale_aware	mh_multi	1	1	1	0.012206	+0.003006	keep	scale_factor=5.0 — new best!
33	128	de_mcz	scale_aware	mh_multi	1	1	1	0.000000	-0.012206	discard	scale_factor=8.0: too wide, R-hat>1.1
34	128	momentum	scale_aware	mh_multi	1	1	1	0.000000	-0.012206	discard	conservative momentum alpha=0.3: R-hat>1.1
35	128	de_mcz	scale_aware	mh_delayed	1	1	1	0.005827	-0.006379	discard	mh_delayed DR: 2 evals, second stage doesn't recover ESS
36	64	de_mcz	scale_aware	mh_multi	1	1	1	0.012118	-0.000088	discard	64W slightly worse than 128W
37	128	whitened	scale_aware	mh_multi	1	1	1	0.000000	-0.012206	discard	whitened scale_factor=0.2: R-hat up to 20 (width miscalibrated)
38	128	de_mcz	scale_aware	mh_multi	1	2	2	0.009939	-0.002267	discard	n_slices=2 orthogonal dirs: 1.8x ESS at 2x cost, net worse
39	128	de_mcz	scale_aware	mh_multi	1	1	1	0.010798	-0.001408	discard	scale_factor=7.0 worse than 5.0
40	128	de_mcz	scale_aware	mh_adaptive	1	1	1	0.011507	-0.000699	discard	full-cov MH 2.38/sqrt(d): worse on hard targets
41	128	de_mcz	scale_aware	mh_multi	1	1	1	0.011712	-0.000494	discard	scale_factor=6.0 worse than 5.0
42	128	de_mcz	scale_aware	mh_multi	1	1	1	0.012592	+0.000386	keep	scale_factor=4.0 NEW BEST
43	128	de_mcz	scale_aware	mh_multi	1	1	1	0.012009	-0.000583	discard	scale_factor=3.5 worse than 4.0
44	128	de_mcz	scale_aware	mh_multi	1	1	1	0.012403	-0.000189	discard	scale_factor=4.5 worse than 4.0
45	128	de_mcz	cov_aware	mh_multi	1	1	1	0.002484	-0.010108	discard	cov_aware bug: cov_chol=identity (never updated), R-hat fail on hard targets
46	128	de_mcz	cov_aware	mh_multi	1	1	1	0.012850	+0.000258	keep	cov_aware(4.0) NEW BEST — exact sigma_d beats scale_aware proxy
47	128	de_mcz	cov_aware	mh_multi	1	1	1	0.011477	-0.001373	discard	cov_aware scale_factor=3.0 worse than 4.0
48	128	de_mcz	cov_aware	mh_multi	1	1	1	0.014727	+0.001877	keep	cov_aware scale_factor=5.0 NEW BEST
49	128	de_mcz	cov_aware	mh_multi	1	1	1	0.014616	-0.000111	discard	cov_aware scale_factor=6.0 slightly worse
50	128	de_mcz	cov_aware	mh_multi	1	1	1	0.014426	-0.000301	discard	cov_aware scale_factor=4.5 worse than 5.0
51	128	de_mcz	cov_aware	mh_multi	1	1	1	0.015464	+0.000737	keep	cov_aware scale_factor=5.5 NEW BEST
52	128	de_mcz	cov_aware	mh_multi	1	1	1	0.015307	-0.000157	discard	cov_aware scale_factor=6.5 slightly worse than 5.5
53	256	de_mcz	cov_aware	mh_multi	1	1	1	0.015565	+0.000101	keep	256W marginal improvement; richer Z-matrix helps slightly
54	256	pca	cov_aware	mh_multi	1	1	1	0.013918	-0.001647	discard	pca_mix=1.0: 2x better ill_cond but kills mixture_10 (0.016 vs 0.031)
55	256	pca	cov_aware	mh_multi	1	1	1	0.013760	-0.001805	discard	pca_mix=0.5: intermediate but still worse on mixture_10
56	256	coordinate	cov_aware	mh_multi	1	1	1	0.015201	-0.000364	discard	coord_mix=0.3: hurts ill_cond/correlated, marginal gain on mixture_10
57	256	de_mcz	cov_aware	mh_multi	1	1	1	0.005056	-0.010509	discard	inverse formula scale_factor=2.0: mixture_10 R-hat fail (walkers trapped in modes)
58	256	de_mcz→pca	cov_aware	mh_multi	1	1	1	0.013780	-0.001785	discard	adaptive PCA threshold=20: mixture_10 cond=22>20, wrong switch; all targets worse
59	256	de_mcz→pca	cov_aware	mh_multi	1	1	1	0.013780	0.000000	discard	threshold=40, pca_mix default=0.5: PCA blended, still kills mixture_10 cond=22
60	256	de_mcz→pca	cov_aware	mh_multi	1	1	1	0.016423	+0.000858	keep	threshold=40, pca_mix=1.0, dir_mod fix: NEW BEST; but corr_60 hurt (empirical cond=56>40, wrong PCA switch)
61	256	de_mcz→pca	cov_aware	mh_multi	1	1	1	pending	pending	pending	threshold=100: keeps corr_60 with DE-MCz (cond=56<100), ill_cond stays PCA (cond=1280>100)
